{
  "schema_version": "1.1",
  "dictionary_version": "dict-2026-09-18-1",
  "tags": {
    "tag": "undefined",
    "urgency": "medium",
    "complexity": "medium"
  },
  "tip": null,
  "customer_reply": null,
  "evidence_message_ids": ["msg_example_attachment"],
  "evidence_memory_ids": [],
  "missing_information": ["Содержимое вложения недоступно для распознавания"],
  "confidence": 0,
  "needs_review": true
}
